{
  "blocks": [
    {
      "level": 2,
      "text": "오늘의 목표",
      "type": "heading"
    },
    {
      "text": "대기권을 4개 층으로 나누어 설명하고, 온실효과를 복사 평형으로 설명할 수 있다.",
      "type": "paragraph"
    },
    {
      "columns": [
        {
          "key": "col1",
          "label": "학년·반"
        },
        {
          "key": "col2",
          "label": "번호"
        },
        {
          "key": "col3",
          "label": "이름"
        },
        {
          "key": "col4",
          "label": "날짜"
        }
      ],
      "rows": [
        {
          "col1": "────────",
          "col2": "────────",
          "col3": "────────",
          "col4": "────────"
        }
      ],
      "type": "table"
    },
    {
      "level": 2,
      "text": "대기권 층상 구조 자료",
      "type": "heading"
    },
    {
      "columns": [
        {
          "key": "col1",
          "label": "층"
        },
        {
          "key": "col2",
          "label": "고도 범위"
        },
        {
          "key": "col3",
          "label": "기온 변화"
        },
        {
          "key": "col4",
          "label": "특징"
        }
      ],
      "rows": [
        {
          "col1": "대류권",
          "col2": "지표~약 11 km",
          "col3": "높을수록 하강",
          "col4": "기상 현상·대류"
        },
        {
          "col1": "성층권",
          "col2": "약 11~50 km",
          "col3": "높을수록 상승",
          "col4": "오존층"
        },
        {
          "col1": "중간권",
          "col2": "약 50~80 km",
          "col3": "높을수록 하강",
          "col4": "유성 관측"
        },
        {
          "col1": "열권",
          "col2": "약 80 km 이상",
          "col3": "높을수록 상승",
          "col4": "오로라"
        }
      ],
      "type": "table"
    },
    {
      "text": "※ 교사 제작 학습자료이며 공식 인용문이 아닙니다.",
      "type": "paragraph"
    },
    {
      "text": "과제 [분석] 대기 자료를 읽고 대기권을 네 개 층으로 구분한 근거를 쓰시오.",
      "type": "paragraph"
    },
    {
      "text": "____________________________________________________________",
      "type": "paragraph"
    },
    {
      "text": "____________________________________________________________",
      "type": "paragraph"
    },
    {
      "text": "____________________________________________________________",
      "type": "paragraph"
    },
    {
      "type": "page_break"
    },
    {
      "text": "과제 [평가] 온실효과가 커질 때 지표 부근 기온이 어떻게 변하는지 복사 평형을 근거로 설명하시오.",
      "type": "paragraph"
    },
    {
      "text": "____________________________________________________________",
      "type": "paragraph"
    },
    {
      "text": "____________________________________________________________",
      "type": "paragraph"
    },
    {
      "text": "____________________________________________________________",
      "type": "paragraph"
    },
    {
      "level": 2,
      "text": "스스로 점검",
      "type": "heading"
    },
    {
      "columns": [
        {
          "key": "col1",
          "label": "확인"
        },
        {
          "key": "col2",
          "label": "점검 내용"
        }
      ],
      "rows": [
        {
          "col1": "□",
          "col2": "대기권을 네 개 층으로 근거와 함께 구분했다."
        },
        {
          "col1": "□",
          "col2": "온실효과를 복사 평형으로 설명했다."
        }
      ],
      "type": "table"
    },
    {
      "level": 2,
      "text": "출구표(가장 어려운 사례)",
      "type": "heading"
    },
    {
      "text": "온실효과가 계속 커지면 지표면 온도는 어떻게 될지 근거와 함께 쓰시오.",
      "type": "paragraph"
    }
  ],
  "metadata": {
    "document_type": "보고서",
    "grade": "중학교 3학년",
    "standard": "[9과17-01]",
    "subject": "과학"
  },
  "schemaVersion": "hwpx.document_plan.v1",
  "title": "대기권과 기상 학생 활동지"
}
